{
  "avisos": [],
  "gerado_em": "2026-08-26T20:41:14+00:00",
  "prova": {
    "ano": 2022,
    "banca": "CEBRASPE",
    "cargo": "Procurador do Distrito Federal (Categoria I)",
    "fonte_gabarito": "https://cdn.cebraspe.org.br/concursos/pg_df_22_procurador/arquivos/GAB_DEFINITIVO_MATRIZ_685_PG_DF_001_00.PDF",
    "fonte_pdf": "https://cdn.cebraspe.org.br/concursos/pg_df_22_procurador/arquivos/MATRIZ_685_PG_DF_001_COM_JUST.PDF",
    "formato": "ce",
    "orgao": "PGDF",
    "penalidade_por_erro": true,
    "perfil": "pg_df_22_procurador",
    "sha256_gabarito": "5a4ffccd975e758664123ee83bed7879c0e83eb62a5a85505383046a5bbbeb2b",
    "sha256_pdf": "57ee232dc0ed1c7cfec091cd620e9bf1554e9c4062d748458b52012adbecc0c0",
    "slug": "pg_df_22_procurador"
  },
  "questoes": [
    {
      "alternativas": [],
      "anulada": false,
      "assets": [],
      "assunto": null,
      "atribuicao": {
        "ano": 2022,
        "banca": "CEBRASPE",
        "cargo": "Procurador do Distrito Federal (Categoria I)",
        "numero_original": 1,
        "orgao": "PGDF",
        "url_pdf": "https://cdn.cebraspe.org.br/concursos/pg_df_22_procurador/arquivos/MATRIZ_685_PG_DF_001_COM_JUST.PDF"
      },
      "classificacao_confianca": null,
      "classificacao_metodo": "nulo",
      "desatualizada": false,
      "disciplina": null,
      "enunciado": "Sem prejuízo da autonomia estadual e distrital, o princípio da\nsimetria impõe que os estados e o DF observem as regras\nfederais sobre reserva de iniciativa legislativa.",
      "gabarito": "C",
      "numero": 1,
      "pagina": 2,
      "tipo": "ce"
    },
    {
      "alternativas": [],
      "anulada": false,
      "assets": [],
      "assunto": null,
      "atribuicao": {
        "ano": 2022,
        "banca": "CEBRASPE",
        "cargo": "Procurador do Distrito Federal (Categoria I)",
        "numero_original": 2,
        "orgao": "PGDF",
        "url_pdf": "https://cdn.cebraspe.org.br/concursos/pg_df_22_procurador/arquivos/MATRIZ_685_PG_DF_001_COM_JUST.PDF"
      },
      "classificacao_confianca": null,
      "classificacao_metodo": "nulo",
      "desatualizada": false,
      "disciplina": null,
      "enunciado": "O mecanismo de revisão constitucional e os estados\nconstitucionais de emergência, como a intervenção federal,\nsão as principais garantias da rigidez constitucional em sua\ndimensão de supralegalidade.",
      "gabarito": "E",
      "numero": 2,
      "pagina": 2,
      "tipo": "ce"
    },
    {
      "alternativas": [],
      "anulada": false,
      "assets": [],
      "assunto": null,
      "atribuicao": {
        "ano": 2022,
        "banca": "CEBRASPE",
        "cargo": "Procurador do Distrito Federal (Categoria I)",
        "numero_original": 3,
        "orgao": "PGDF",
        "url_pdf": "https://cdn.cebraspe.org.br/concursos/pg_df_22_procurador/arquivos/MATRIZ_685_PG_DF_001_COM_JUST.PDF"
      },
      "classificacao_confianca": null,
      "classificacao_metodo": "nulo",
      "desatualizada": false,
      "disciplina": null,
      "enunciado": "A modificação da Constituição por meio de emendas\nimpossibilita o fenômeno da mutação constitucional.",
      "gabarito": "E",
      "numero": 3,
      "pagina": 2,
      "tipo": "ce"
    },
    {
      "alternativas": [],
      "anulada": false,
      "assets": [],
      "assunto": null,
      "atribuicao": {
        "ano": 2022,
        "banca": "CEBRASPE",
        "cargo": "Procurador do Distrito Federal (Categoria I)",
        "numero_original": 4,
        "orgao": "PGDF",
        "url_pdf": "https://cdn.cebraspe.org.br/concursos/pg_df_22_procurador/arquivos/MATRIZ_685_PG_DF_001_COM_JUST.PDF"
      },
      "classificacao_confianca": null,
      "classificacao_metodo": "nulo",
      "desatualizada": false,
      "disciplina": null,
      "enunciado": "Uma proposta de emenda à Constituição que haja sido\nrejeitada no Congresso Nacional somente poderá ser\nreapresentada na legislatura subsequente.",
      "gabarito": "E",
      "numero": 4,
      "pagina": 2,
      "tipo": "ce"
    },
    {
      "alternativas": [],
      "anulada": false,
      "assets": [],
      "assunto": null,
      "atribuicao": {
        "ano": 2022,
        "banca": "CEBRASPE",
        "cargo": "Procurador do Distrito Federal (Categoria I)",
        "numero_original": 5,
        "orgao": "PGDF",
        "url_pdf": "https://cdn.cebraspe.org.br/concursos/pg_df_22_procurador/arquivos/MATRIZ_685_PG_DF_001_COM_JUST.PDF"
      },
      "classificacao_confianca": null,
      "classificacao_metodo": "nulo",
      "desatualizada": false,
      "disciplina": null,
      "enunciado": "Conquanto a forma federativa seja cláusula pétrea na\nConstituição Federal de 1988, ajustes na repartição\nconstitucional de competências podem ser adotados, sem que\nisso configure ofensa ao princípio federativo.",
      "gabarito": "C",
      "numero": 5,
      "pagina": 2,
      "tipo": "ce"
    },
    {
      "alternativas": [],
      "anulada": false,
      "assets": [],
      "assunto": null,
      "atribuicao": {
        "ano": 2022,
        "banca": "CEBRASPE",
        "cargo": "Procurador do Distrito Federal (Categoria I)",
        "numero_original": 6,
        "orgao": "PGDF",
        "url_pdf": "https://cdn.cebraspe.org.br/concursos/pg_df_22_procurador/arquivos/MATRIZ_685_PG_DF_001_COM_JUST.PDF"
      },
      "classificacao_confianca": null,
      "classificacao_metodo": "nulo",
      "desatualizada": false,
      "disciplina": null,
      "enunciado": "Qualquer norma de tratado internacional de direitos humanos\naprovada pelo Congresso Nacional na forma prevista no art.\n5.º da Constituição Federal de 1988 passa a ter status de\nnorma constitucional.",
      "gabarito": "C",
      "numero": 6,
      "pagina": 2,
      "tipo": "ce"
    },
    {
      "alternativas": [],
      "anulada": false,
      "assets": [],
      "assunto": null,
      "atribuicao": {
        "ano": 2022,
        "banca": "CEBRASPE",
        "cargo": "Procurador do Distrito Federal (Categoria I)",
        "numero_original": 7,
        "orgao": "PGDF",
        "url_pdf": "https://cdn.cebraspe.org.br/concursos/pg_df_22_procurador/arquivos/MATRIZ_685_PG_DF_001_COM_JUST.PDF"
      },
      "classificacao_confianca": null,
      "classificacao_metodo": "nulo",
      "desatualizada": false,
      "disciplina": null,
      "enunciado": "Descumprimento de decisão judicial não transitada em\njulgado pode, em princípio, ensejar intervenção federal.",
      "gabarito": "C",
      "numero": 7,
      "pagina": 2,
      "tipo": "ce"
    },
    {
      "alternativas": [],
      "anulada": false,
      "assets": [],
      "assunto": null,
      "atribuicao": {
        "ano": 2022,
        "banca": "CEBRASPE",
        "cargo": "Procurador do Distrito Federal (Categoria I)",
        "numero_original": 8,
        "orgao": "PGDF",
        "url_pdf": "https://cdn.cebraspe.org.br/concursos/pg_df_22_procurador/arquivos/MATRIZ_685_PG_DF_001_COM_JUST.PDF"
      },
      "classificacao_confianca": null,
      "classificacao_metodo": "nulo",
      "desatualizada": false,
      "disciplina": null,
      "enunciado": "Em virtude do princípio da independência funcional dos\nmembros do Ministério Público, nem mesmo o Poder\nJudiciário pode determinar que certa pessoa seja processada\nem ação cível ou criminal a ser ajuizada pelo órgão.",
      "gabarito": "C",
      "numero": 8,
      "pagina": 2,
      "tipo": "ce"
    },
    {
      "alternativas": [],
      "anulada": false,
      "assets": [],
      "assunto": null,
      "atribuicao": {
        "ano": 2022,
        "banca": "CEBRASPE",
        "cargo": "Procurador do Distrito Federal (Categoria I)",
        "numero_original": 9,
        "orgao": "PGDF",
        "url_pdf": "https://cdn.cebraspe.org.br/concursos/pg_df_22_procurador/arquivos/MATRIZ_685_PG_DF_001_COM_JUST.PDF"
      },
      "classificacao_confianca": null,
      "classificacao_metodo": "nulo",
      "desatualizada": false,
      "disciplina": null,
      "enunciado": "A despeito da autonomia do DF, a CLDF não pode fixar, por\nmeio de resolução, a remuneração de seus servidores\npúblicos.",
      "gabarito": "C",
      "numero": 9,
      "pagina": 2,
      "tipo": "ce"
    },
    {
      "alternativas": [],
      "anulada": false,
      "assets": [],
      "assunto": null,
      "atribuicao": {
        "ano": 2022,
        "banca": "CEBRASPE",
        "cargo": "Procurador do Distrito Federal (Categoria I)",
        "numero_original": 10,
        "orgao": "PGDF",
        "url_pdf": "https://cdn.cebraspe.org.br/concursos/pg_df_22_procurador/arquivos/MATRIZ_685_PG_DF_001_COM_JUST.PDF"
      },
      "classificacao_confianca": null,
      "classificacao_metodo": "nulo",
      "desatualizada": false,
      "disciplina": null,
      "enunciado": "Ferirá prerrogativa do governador do DF lei aprovada pela\nCLDF que estabeleça a obrigatoriedade de o procurador-\ngeral do DF ser escolhido entre os membros da carreira.",
      "gabarito": "C",
      "numero": 10,
      "pagina": 2,
      "tipo": "ce"
    },
    {
      "alternativas": [],
      "anulada": false,
      "assets": [],
      "assunto": null,
      "atribuicao": {
        "ano": 2022,
        "banca": "CEBRASPE",
        "cargo": "Procurador do Distrito Federal (Categoria I)",
        "numero_original": 11,
        "orgao": "PGDF",
        "url_pdf": "https://cdn.cebraspe.org.br/concursos/pg_df_22_procurador/arquivos/MATRIZ_685_PG_DF_001_COM_JUST.PDF"
      },
      "classificacao_confianca": null,
      "classificacao_metodo": "nulo",
      "desatualizada": false,
      "disciplina": null,
      "enunciado": "O descumprimento de decisão judicial pelo governador do\nDF o sujeitará a julgamento pelo STJ.",
      "gabarito": "E",
      "numero": 11,
      "pagina": 3,
      "tipo": "ce"
    },
    {
      "alternativas": [],
      "anulada": false,
      "assets": [],
      "assunto": null,
      "atribuicao": {
        "ano": 2022,